{
  "$schema": "./missing-components.schema.json",
  "generatedAt": "2026-07-04T08:55:46.138Z",
  "source": {
    "magicuiGeneratedAt": "2026-07-04T08:55:44.812Z",
    "sparkuiGeneratedAt": "2026-07-04T08:55:45.617Z"
  },
  "count": 61,
  "components": [
    {
      "name": "Android",
      "slug": "android",
      "title": "Android",
      "description": "A mockup of an Android device.",
      "sourcePath": "apps/www/registry/magicui/android.tsx",
      "sourceFiles": [
        "apps/www/registry/magicui/android.tsx"
      ],
      "lastCommitHash": "61f1aa5aa28dafa459e7d011e46ce2392b22ee24",
      "dependencies": [
        "react"
      ],
      "registryDependencies": [],
      "usesAnimation": false,
      "usesFramerMotion": false,
      "usesMotion": false,
      "demoFiles": [
        "apps/www/registry/example/android-demo-2.tsx",
        "apps/www/registry/example/android-demo-3.tsx",
        "apps/www/registry/example/android-demo.tsx"
      ],
      "docsFiles": [
        "apps/www/content/docs/components/android.mdx"
      ],
      "issueTitle": "[Agent] Port Android from MagicUI",
      "targetBranch": "agent/android",
      "pullRequestTitle": "feat(android): add SparkUI port",
      "requirements": [
        "Port the MagicUI React component to Vue 3 using <script setup lang=\"ts\">.",
        "Use TailwindCSS and SparkUI naming/layout conventions.",
        "Use Motion for Vue when the MagicUI source uses Framer Motion or motion/react.",
        "Add docs, examples, and focused tests for the new SparkUI component.",
        "Do not use React, JSX, clsx, class-variance-authority, Radix, or shadcn/ui."
      ]
    },
    {
      "name": "AnimatedCircularProgressBar",
      "slug": "animated-circular-progress-bar",
      "title": "Animated Circular Progress Bar",
      "description": "Animated Circular Progress Bar is a component that displays a circular gauge with a percentage value.",
      "sourcePath": "apps/www/registry/magicui/animated-circular-progress-bar.tsx",
      "sourceFiles": [
        "apps/www/registry/magicui/animated-circular-progress-bar.tsx"
      ],
      "lastCommitHash": "61f1aa5aa28dafa459e7d011e46ce2392b22ee24",
      "dependencies": [],
      "registryDependencies": [],
      "usesAnimation": true,
      "usesFramerMotion": false,
      "usesMotion": false,
      "demoFiles": [
        "apps/www/registry/example/animated-circular-progress-bar-demo.tsx"
      ],
      "docsFiles": [
        "apps/www/content/docs/components/animated-circular-progress-bar.mdx"
      ],
      "issueTitle": "[Agent] Port AnimatedCircularProgressBar from MagicUI",
      "targetBranch": "agent/animated-circular-progress-bar",
      "pullRequestTitle": "feat(animated-circular-progress-bar): add SparkUI port",
      "requirements": [
        "Port the MagicUI React component to Vue 3 using <script setup lang=\"ts\">.",
        "Use TailwindCSS and SparkUI naming/layout conventions.",
        "Use Motion for Vue when the MagicUI source uses Framer Motion or motion/react.",
        "Add docs, examples, and focused tests for the new SparkUI component.",
        "Do not use React, JSX, clsx, class-variance-authority, Radix, or shadcn/ui."
      ]
    },
    {
      "name": "AnimatedGridPattern",
      "slug": "animated-grid-pattern",
      "title": "Animated Grid Pattern",
      "description": "A animated background grid pattern made with SVGs, fully customizable using Tailwind CSS.",
      "sourcePath": "apps/www/registry/magicui/animated-grid-pattern.tsx",
      "sourceFiles": [
        "apps/www/registry/magicui/animated-grid-pattern.tsx"
      ],
      "lastCommitHash": "61f1aa5aa28dafa459e7d011e46ce2392b22ee24",
      "dependencies": [
        "motion",
        "react"
      ],
      "registryDependencies": [],
      "usesAnimation": true,
      "usesFramerMotion": true,
      "usesMotion": true,
      "demoFiles": [
        "apps/www/registry/example/animated-grid-pattern-demo.tsx"
      ],
      "docsFiles": [
        "apps/www/content/docs/components/animated-grid-pattern.mdx"
      ],
      "issueTitle": "[Agent] Port AnimatedGridPattern from MagicUI",
      "targetBranch": "agent/animated-grid-pattern",
      "pullRequestTitle": "feat(animated-grid-pattern): add SparkUI port",
      "requirements": [
        "Port the MagicUI React component to Vue 3 using <script setup lang=\"ts\">.",
        "Use TailwindCSS and SparkUI naming/layout conventions.",
        "Use Motion for Vue when the MagicUI source uses Framer Motion or motion/react.",
        "Add docs, examples, and focused tests for the new SparkUI component.",
        "Do not use React, JSX, clsx, class-variance-authority, Radix, or shadcn/ui."
      ]
    },
    {
      "name": "ThemeToggler",
      "slug": "animated-theme-toggler",
      "title": "Theme Toggler",
      "description": "Theme toggle with View Transitions and animated clip-path masks (circle, polygons, star), optional viewport-centered origin.",
      "sourcePath": "apps/www/registry/magicui/animated-theme-toggler.tsx",
      "sourceFiles": [
        "apps/www/registry/magicui/animated-theme-toggler.tsx"
      ],
      "lastCommitHash": "61f1aa5aa28dafa459e7d011e46ce2392b22ee24",
      "dependencies": [
        ")\n    }\n\n    const transition = document.startViewTransition(() => {\n      flushSync(applyTheme)\n    })\n    if (typeof transition?.finished?.finally === ",
        ", clipPath[0])\n    const cleanup = () => {\n      delete root.dataset.magicuiThemeVt\n      root.style.removeProperty(",
        "lucide-react",
        "react",
        "react-dom"
      ],
      "registryDependencies": [],
      "usesAnimation": true,
      "usesFramerMotion": false,
      "usesMotion": false,
      "demoFiles": [
        "apps/www/registry/example/animated-theme-toggler-demo.tsx",
        "apps/www/registry/example/animated-theme-toggler-diamond-demo.tsx",
        "apps/www/registry/example/animated-theme-toggler-hexagon-demo.tsx",
        "apps/www/registry/example/animated-theme-toggler-next-themes-demo.tsx",
        "apps/www/registry/example/animated-theme-toggler-rectangle-demo.tsx",
        "apps/www/registry/example/animated-theme-toggler-square-demo.tsx",
        "apps/www/registry/example/animated-theme-toggler-star-demo.tsx",
        "apps/www/registry/example/animated-theme-toggler-triangle-demo.tsx"
      ],
      "docsFiles": [
        "apps/www/content/docs/components/animated-theme-toggler.mdx"
      ],
      "issueTitle": "[Agent] Port ThemeToggler from MagicUI",
      "targetBranch": "agent/animated-theme-toggler",
      "pullRequestTitle": "feat(animated-theme-toggler): add SparkUI port",
      "requirements": [
        "Port the MagicUI React component to Vue 3 using <script setup lang=\"ts\">.",
        "Use TailwindCSS and SparkUI naming/layout conventions.",
        "Use Motion for Vue when the MagicUI source uses Framer Motion or motion/react.",
        "Add docs, examples, and focused tests for the new SparkUI component.",
        "Do not use React, JSX, clsx, class-variance-authority, Radix, or shadcn/ui."
      ]
    },
    {
      "name": "AuroraText",
      "slug": "aurora-text",
      "title": "Aurora Text",
      "description": "A beautiful aurora text effect",
      "sourcePath": "apps/www/registry/magicui/aurora-text.tsx",
      "sourceFiles": [
        "apps/www/registry/magicui/aurora-text.tsx"
      ],
      "lastCommitHash": "61f1aa5aa28dafa459e7d011e46ce2392b22ee24",
      "dependencies": [
        "react"
      ],
      "registryDependencies": [],
      "usesAnimation": true,
      "usesFramerMotion": false,
      "usesMotion": false,
      "demoFiles": [
        "apps/www/registry/example/aurora-text-demo.tsx"
      ],
      "docsFiles": [
        "apps/www/content/docs/components/aurora-text.mdx"
      ],
      "issueTitle": "[Agent] Port AuroraText from MagicUI",
      "targetBranch": "agent/aurora-text",
      "pullRequestTitle": "feat(aurora-text): add SparkUI port",
      "requirements": [
        "Port the MagicUI React component to Vue 3 using <script setup lang=\"ts\">.",
        "Use TailwindCSS and SparkUI naming/layout conventions.",
        "Use Motion for Vue when the MagicUI source uses Framer Motion or motion/react.",
        "Add docs, examples, and focused tests for the new SparkUI component.",
        "Do not use React, JSX, clsx, class-variance-authority, Radix, or shadcn/ui."
      ]
    },
    {
      "name": "Backlight",
      "slug": "backlight",
      "title": "Backlight",
      "description": "A backlight glow effect for videos, images, and SVGs.",
      "sourcePath": "apps/www/registry/magicui/backlight.tsx",
      "sourceFiles": [
        "apps/www/registry/magicui/backlight.tsx"
      ],
      "lastCommitHash": "61f1aa5aa28dafa459e7d011e46ce2392b22ee24",
      "dependencies": [
        "react"
      ],
      "registryDependencies": [],
      "usesAnimation": false,
      "usesFramerMotion": false,
      "usesMotion": false,
      "demoFiles": [
        "apps/www/registry/example/backlight-image-demo.tsx",
        "apps/www/registry/example/backlight-svg-demo.tsx",
        "apps/www/registry/example/backlight-video-demo.tsx"
      ],
      "docsFiles": [
        "apps/www/content/docs/components/backlight.mdx"
      ],
      "issueTitle": "[Agent] Port Backlight from MagicUI",
      "targetBranch": "agent/backlight",
      "pullRequestTitle": "feat(backlight): add SparkUI port",
      "requirements": [
        "Port the MagicUI React component to Vue 3 using <script setup lang=\"ts\">.",
        "Use TailwindCSS and SparkUI naming/layout conventions.",
        "Use Motion for Vue when the MagicUI source uses Framer Motion or motion/react.",
        "Add docs, examples, and focused tests for the new SparkUI component.",
        "Do not use React, JSX, clsx, class-variance-authority, Radix, or shadcn/ui."
      ]
    },
    {
      "name": "BorderBeam",
      "slug": "border-beam",